Primary_id,Primary_type,Secondary_id,Secondary_type,Secondary_relation,Title,Author,Edition,Collection,Fulltext_Read,Fulltext_Search,Fulltext_Download,Image,Volumes,Notes,ChineseTime,Time,OpenAccess,URL
zhonghuajingdian_1,zhonghuajingdian,,,,史,(h)司Rw-撰;(南朝宋)裴-集解;(唐)司R-索[;(唐)守-正x;R-c校;R次君-c校;宋彬-c校;崇岐-c校,1982年11月北京中A局,正史\上古；正史\先秦；正史\秦；正史\西h；o,y,y,n,y,,本共130卷，包括本o12卷、表10卷、8卷、世家30卷、列70卷，是我第一部o黧w通史，d了自上古髡h中的黄帝r代（前3000）直至h武帝元狩元年（前122）近三千年的v史。作者以其“究天人之H、通古今之、成一家之言”的作史原t，地h了@一r段内有P政治、、事、文化等各方面的羁觯是研究h武帝以前中v史最嗤的Y料。F存《史》f注有三家，即⑺闻狁的《史集解》、唐司R的《史索[》和守的《史正x》，自北宋起，三家注便散列于正文下，合一。本以金陵局刊行的《史集解所引正x合刻本》底本，同r⑿Ｆ渌\多版本，并把原砩⒘性谡文之下的三家注移到每段之後，由R先生等分段它c。,,1982,NO,http://www.gujilianhe.com/pages/productmetadata/form/list?id=ff80808154b87f9301550d90a18478da
zhonghuajingdian_2,zhonghuajingdian,,,,h,(h)班固-撰;(唐)古-注;郭K武-c校;RL-c校;枪P-c校;S-c校;冉昭德-c校;登原-c校;李之勤-c校;直-c校;Z正中-c校;⑶尻-c校;傅|A-c校,1962年6月北京中A局,正史\西h；o,y,y,n,y,,本共120卷，包括o13卷、表10卷、志18卷、列79卷，是我第一部o黧w啻史，d了自h高祖元年（前206）至王莽地皇四年（23）共230年g的史事。《h》w例上完全承u《史》，只是改“”“志”，把“世家”并入“列鳌保此後正史的纂，皆以其颖尽Ｔ采用大量的t令、奏h、x、天文逊及“耳”，不少原始史料全文h入，故相比《史》更具史料r值。本以王先t的《ha注》本底本，由西北大Wv史系分段它c，析出注文，但H收h古注，未⒀a注收入其中。同r，本在c校r⒂昧吮彼尉暗v本、明末毛氏汲古w本、清乾隆武英殿本和同治金陵局四N版本，并⑿Ａ饲叭说难芯砍晒及溥_的a正。,,1962,NO,http://www.gujilianhe.com/pages/productmetadata/form/list?id=ff80808154b87f9301550da8b5cd2248
zhonghuajingdian_3,zhonghuajingdian,,,,後h,(宋)范-撰;(唐)李t 等-注;金兆梓-c校;R次君-c校;O毓棠-c校;R宗霍-c校;曾次亮-c校;O人和-c校;宋彬-c校,1965年5月北京中A局,正史\|h；o,y,y,n,y,,全共120卷，包括本o10卷、列80卷、志30卷，d了自|h光武帝建武元年（25）至hI帝建安二十五年（220）共195年的v史。作者以《|^h》等各家所撰後h史⒖迹自定w例，厘定成，使本成研究|hv史最重要的文I。范显定纂十o、十志、八十列鳎合百卷，但十志未及成便遭⒑Γ今本《後h》中的律选⒍Yx、祭祀等八志乃取自司R彪《mh》，以填a。本以宋Bd刊本底本，并用汲古w本c武英殿本M行π＃{整序，重新目，同r⒖剂舜罅壳叭搜芯砍晒，是目前^完善的版本。,,1965,NO,http://www.gujilianhe.com/pages/productmetadata/form/list?id=ff80808154b87f9301550cee78ca40e3
zhonghuajingdian_4,zhonghuajingdian,,,,三志,(x)-撰;(南朝宋)裴松之-注;乃乾-c校;周振甫-c校;傅|A-c校,1982年7月北京中A局,正史\|h；正史\三；o,y,y,n,y,,本共65卷，是一部o黧w啻别史，d了奈何牡刍瞥踉年（220）到x武帝太康元年（280）共60年的v史。《三志》以家叙史挝唬把三分成三，其中魏30卷，蜀15卷，吴20卷，在啻史中别一格。南朝宋裴松之V泛搜壑後的三史料《三志》作注，着重于事的增a和考，使得注的内容超^原当叮故裴注的史料r值更珍F。本以百衲本、清武英殿本、金陵局本、江南局本互相勘Γ裆贫模并采用了梁章《三志旁C》及R弼《三志集解》的研究成果，加采Y杲、翁同、钔ā⑽獬惺酥T家之h，M行M一步的整理，故本是目前^完善的版本。,,1982,NO,http://www.gujilianhe.com/pages/productmetadata/form/list?id=ff80808154b87f9301550db9fefd35cb
zhonghuajingdian_5,zhonghuajingdian,,,,x,(唐)房玄g 等-撰;吴t虞-c校;畈峻-c校;吴翊如-c校;汪B楹-c校;丁韵-c校;唐L孺-c校;法-c校;忱石-c校,1974年11月北京中A局,正史\x；正史\十六；o,y,y,n,y,,本共130卷，包括帝o10卷、志20卷、列70卷、d30卷。其叙事始于西x高祖宣帝司R懿，止于宋武帝⒃４x（420），d了西x和|x沙的d亡史。其“d”30卷，述了匈奴、r卑、羯、氐、羌等十六割政嗟氖肥拢是o黧w史w例上的一新。本以金陵局本工作本，c宋本、清武英殿本互校，并⒖剂嗽二十二字本、明南北O本、吴本、周本、毛本的文字歧x，η叭诵？背晒也多有汲取。,,1974,NO,http://www.gujilianhe.com/pages/productmetadata/form/list?id=ff80808154b87f9301550dcf576b5a35
zhonghuajingdian_6,zhonghuajingdian,,,,宋,(梁)沈s-撰;王仲-c校;傅璇琮-c校,1974年10月北京中A局,正史\南朝宋；o,y,y,n,y,,全共100卷，包括本o10卷、志30卷、列60卷，d了x恭帝元熙二年⒃＝ㄋ危420）起到宋帝N明三年（479）60年g的史事。由于纂rg^早，中保存了很多珍F的史料，尤其是收藏了r人的S多奏h、和文章，具有很高的史料r值。本以宋元明三朝f修本、明北O本、毛氏汲古w本、清乾隆四年武英殿本、金陵局本及商沼^影印百衲本底本相互校Γ裆贫模同r通校了其他史籍的有P部分，并吸收了前人的校勘成果，了易于z，重新排了全的目。,,1974,NO,http://www.gujilianhe.com/pages/productmetadata/form/list?id=ff80808154b87f9301550c637c9f0eac
zhonghuajingdian_7,zhonghuajingdian,,,,南R,(梁)子@-撰;王仲-c校;宋彬-c校,1972年1月北京中A局,正史\南朝R；o,y,y,n,y,,本原60卷，F存59卷，其中本o8卷、志11卷、列40卷，述了哪淆R高帝道成建（479）到梁武帝缒淆R（502）前後23年的v史。南R是南北朝r期最短促的一朝代，作者以代人代事，在中保存了一定盗康脑始史料，r值^高。本以百衲本底本，⑿Ａ嗣髂媳O本、北O本、汲古w本、清武英殿本、金陵局本。另外，本⑿Ａ松蚣s《宋》中的志，以及《南史》《通典》《册府元》《太平御[》《Y治通a》《Y治通a考》等的有P部分，并吸取了大量前人的研究成果。,,1972,NO,http://www.gujilianhe.com/pages/productmetadata/form/list?id=ff80808154b87f9301550e07204d0830
zhonghuajingdian_8,zhonghuajingdian,,,,梁,(唐)姚思廉-撰;R振A-c校;宋彬-c校;王仲-c校;w守-c校,1973年5月北京中A局,正史\南朝梁；o,y,y,n,y,,本共56卷，包括本o6卷、列50卷，述了南朝R末年的政治和梁皇朝（502―557）五十N年的史事，其中的26卷出自作者父H姚察之手。姚思廉撰《梁》，除^承其父的z稿外，吸取了梁、、隋v朝史家撰梁史的成果。本特c之一是引文以外的部分以散文而不以r流行的w文。本用百衲本及明南O本、北O本、汲古w本，清武英殿本、金陵局本互校，裆贫模⒖剂恕赌鲜贰贰恫岣元》《Y治通a》和《Y治通a考》的有P部分，并汲取了大量前人的研究成果，是目前最好的版本。,,1973,NO,http://www.gujilianhe.com/pages/productmetadata/form/list?id=ff80808154b87f9301550c75f32d2025
zhonghuajingdian_9,zhonghuajingdian,,,,,(唐)姚思廉-撰;SA-c校;王仲-c校,1972年3月北京中A局,正史\南朝；o,y,y,n,y,,本共36卷，其中本o6卷、列30卷，d了自武帝即位（557）至後主亡（589）前後33年的史事。P于代的早期v史著作都已失鳎因此《》就成F存^原始的d。除政治和事}外，本在哲W史、文W史、宗教史、民族PS、ν怅PS方面也都保存了一些Y料，是研究代v史的重要史料。本用百衲本及明南O本、北O本、汲古w本，清武英殿本、金陵局本互校，裆贫模⒖剂恕赌鲜贰贰恫岣元》《Y治通a》和《Y治通a考》的有P部分，并汲取了大量前人的研究成果。某些卷（如卷一、卷三、卷九等）的末尾附有一尚行∽郑乃宋人曾所做校Z，是百衲本原有的，皆予保留，以Y⒖肌,,1972,NO,http://www.gujilianhe.com/pages/productmetadata/form/list?id=ff80808154b87f9301550e2151fb218d
zhonghuajingdian_10,zhonghuajingdian,,,,魏,(北R)魏收-撰;唐L孺-c校;仲安-c校;王永d-c校;魏B科-c校,1974年6月北京中A局,正史\北魏；正史\西魏；正史\|魏；o,y,y,n,y,,本共130卷，其中本o12卷，列98卷，志20卷，d了公元4世o末至6世o中~的北魏王朝d亡史。《魏》是F存叙述北魏v史最原始和^完涞馁Y料，中dr卑拓跋部的早期活樱反映了拓跋部的社面貌，提供了由氏族、部落到家l展^程中的材料，是研究北魏v史的重要史料。本以百衲本、南O本、北O本、汲古w本、武英殿本及金陵局本相互通校，裆贫模并Ρ攘恕短平御[》所引《後魏》及《册府元》《北史》《Y治通a》中有P部分，也⒖剂恕锻ǖ洹贰锻ㄖ尽罚是目前^完涞陌姹尽,,1974,NO,http://www.gujilianhe.com/pages/productmetadata/form/list?id=ff80808154b87f9301550e2f1c163e7a
zhonghuajingdian_11,zhonghuajingdian,,,,北R,(唐)李百-撰;唐L孺-c校;仲安-c校;王文\-c校,1972年11月北京中A局,正史\北R；o,y,y,n,y,,本共50卷，其中帝o8卷、列42卷，d了公元534年前後北魏分裂，|魏政嘟立，中公元550年R代|魏，到公元577年R亡止的v史。《北R》早在唐代中~以後就逐u缺，也不嘤腥搜a缺，到北宋初H十七卷是李百的原文，其N皆後人以《北史》和唐人《史抄》中相Po餮a得。本以元明a版的南宋刻本（三朝本）、南本、北本、汲古w本、武英殿本、局本、百衲本相互校Γ裆贫模并通校了《太平御[》《册府元》《北史》《Y治通a》《通志》中的有P部分，是目前最完善的版本。,,1972,NO,http://www.gujilianhe.com/pages/productmetadata/form/list?id=ff80808154b87f9301550c830f1c2d28
zhonghuajingdian_12,zhonghuajingdian,,,,周,(唐)令狐德 等-撰;唐L孺-c校;仲安-c校;王文\-c校,1971年11月北京中A局,正史\北周；o,y,y,n,y,,本共50卷，其中本o8卷，列42卷，述了|西魏分裂（534）至源周（581）期g的v史。其内容不H涵w西魏及北周皇朝的史事，亦兼同r代的|魏、北R、梁c四朝的重大史事。τ诘畚桓迭、重大y，本皆d，反映了r中v史l展的大荨１在收集考史料方面有所不足，Y料不够完洌但由于成^早，保存的Y料比^原始，足Y⒖肌！吨》在宋初就已缺，此c校本以南宋刻元明f修本、南O本、北O本、汲古w本、武英殿本、金陵局本、百衲本互校，并通校了《册府元》和《北史》中的有P部分，是目前^完善的版本。,,1971,NO,http://www.gujilianhe.com/pages/productmetadata/form/list?id=ff80808154b87f9301550c8e1f353a22
zhonghuajingdian_13,zhonghuajingdian,,,,隋,(唐)魏徵-撰;(唐)令狐德-撰;汪B楹-c校;法-c校;元-c校,1973年8月北京中A局,正史\隋；o,y,y,n,y,,本共85卷，包括帝o5卷，列50卷，志30卷。隋代史料大多已z失，故《隋》的r值更重要。注重以史a，^少[晦，保存了南北朝以前大量的典章制度，且wF出^高的修史水省１以宋刻f修本、宋中字本、元十行本、元九行本、南O本、北O本、汲古w本、武英殿本、淮南局本九本校勘，以宋小字本和煞N元刻本互校，并⒖计渌刻本，裆贫摹４送猓本⒖剂恕锻ǖ洹贰短平御[》《Y治通a》《通志》等的有P部分，并采用了前人Α端》的研究成果，是目前最完涞陌姹尽,,1973,NO,http://www.gujilianhe.com/pages/productmetadata/form/list?id=ff80808154b87f9301550d0f331b6172
zhonghuajingdian_14,zhonghuajingdian,,,,南史,(唐)李延-撰;R振A-c校;王仲-c校;w守-c校;魏B科-c校,1975年6月北京中A局,正史\南朝；o,y,y,n,y,,本共80卷，其中本o10卷、列70卷，起于宋武帝永初元年（420），K于後主明三年（589），述了南朝宋、南R、梁、四封建政喙170年的v史。本由《宋》《南R》《梁》《》等增删而成，突出Ty士族的地位，按世系次列鳎一格。本以百衲本工作本，以武英殿本通校，用南O本、北O本和金陵局本⑿！０姹井同，裆贫摹３版本校勘外，本⑿Ａ恕端巍贰洱R》《梁》《》等“八”以及《通志》《通a》《通典》及《太平御[》等，并吸收了\多前人研究成果。,,1975,NO,http://www.gujilianhe.com/pages/productmetadata/form/list?id=ff80808154b87f9301550d2aef4206c4
zhonghuajingdian_15,zhonghuajingdian,,,,北史,(唐)李延-撰;仲安-c校;唐L孺-c校,1974年10月北京中A局,正史\北朝；o,y,y,n,y,,本共100卷，其中本o12卷、列88卷，d了谋蔽旱牢涞鄣元年（386）到隋恭帝x二年（618），北朝魏、北R（包括|魏）、周（包括西魏）、隋四封建政喙233年的v史。本由《魏》《北R》《周》《隋》等删改而成，a充以r流鞯碾s史，同《南史》按世系次列鳌１采用百衲本校c工作本，以南O本、武英殿本M行通校，以北O本、汲古w本⑿＃又⒄樟家D^所藏宋本卷。版本同，裆贫摹３版本校勘外，本⑿Ａ恕鞍”、《通志》《通a》《通典》及《太平御[》等，并吸收了\多前人研究成果。,,1974,NO,http://www.gujilianhe.com/pages/productmetadata/form/list?id=ff80808154b87f9301550ca12b5462e0
zhonghuajingdian_16,zhonghuajingdian,,,,f唐,(後x)d 等-撰;⒐-c校;乃乾-c校;朱|-c校;吴文祺-c校;守-c校;世禄-c校;⒓靖-c校;胡裕-c校;王\熙-c校;K乾英-c校;易生-c校;徐i-c校;徐B_-c校;SA-c校;周斌武-c校;允吉-c校;周S德-c校;丁a根-c校;f起-c校;~盼-c校;T其J-c校;吴-c校;王天良-c校;胡菊d-c校;嵇超-c校;X林-c校;恒-c校;修桂-c校;孔祥珠-c校;周中民-c校;-c校;李}-c校;~廉-c校;T菊年-c校;⒌-c校;周琪生-c校,1975年5月北京中A局,正史\唐；o,y,y,n,y,,本共200卷，其中帝o20卷，志30卷，列150卷，d了自唐高祖李Y武德元年（618）至唐哀帝李翘煊铀哪辏907）g近三百年的v史，是F存最早的系yh唐代v史的史籍。原名《唐》，因c宋代W修、宋祁等的《唐》相^分，改Q《f唐》。由于修rgx唐代很近，所以μ瞥踔撂拼宗r期的v史事件叙述比^完整，并收有唐高祖至唐文宗的各朝h。本c校，以道光年gP州岑氏钟S工作本，⑿Ａ宋本、本、殿本、局本、V本，裆贫模并⒖剂恕短平御[》《册府元》等，同r吸收了大量前人研究成果。,,1975,NO,http://www.gujilianhe.com/pages/productmetadata/form/list?id=ff80808154b87f9301550b92660f3670
zhonghuajingdian_17,zhonghuajingdian,,,,新唐,(宋)W修-撰;(宋)宋祁-撰;董家遵-c校;石淑x-c校;李x-c校;李德清-c校;吴-c校;沈灌群-c校;周子美-c校;林艾@-c校;金祖孟-c校;袁英光-c校;徐震-c校;徐德嶙-c校;Rds-c校;蚜-c校;梁永昌-c校;惠芬-c校;瑞[-c校;~百S-c校;罘ec-c校;w善r-c校;x天佑-c校;戴家祥-c校;修-c校;祝培坤-c校;u逸麟-c校;w永}-c校;蔡尚思-c校;-c校;李}-c校;~廉-c校;於在春-c校;⒌-c校;T菊年-c校;周琪生-c校,1975年2月北京中A局,正史\唐；o,y,y,n,y,,本共225卷，包括本o10卷、志50卷、表15卷、列150卷，d了自唐高祖李Y至唐哀帝李墙三百年的v史。c《f唐》相比，《新唐》Ρ怼⒅靖重，增加了以往史所没有的xl志、xe志、兵志，宰相表、方表、宗室世系表、宰相世系表等，重新排列饔次序，强{χ壹轫逆的褒H，又增添了卓行、奸臣、叛臣、逆臣等鳎在列髦斜４媪艘恍《f唐》未d的史料，增加了不少晚唐人物的列鳌１以百衲本c校工作本，同r⑿Ａ吮彼伍}刻十六行本、南宋}刻十行影印本、汲古w本、殿本和浙江局本，裆贫摹,,1975,NO,http://www.gujilianhe.com/pages/productmetadata/form/list?id=ff80808154b87f9301550bea0b9215cb
zhonghuajingdian_18,zhonghuajingdian,,,,f五代史,(宋)薛居正 等-撰;垣-c校;⑥-c校;朱|-c校;守-c校;胡裕-c校;K乾英-c校;易生-c校;徐i-c校;周斌武-c校;允吉-c校;f起-c校;周S德-c校;~盼-c校;-c校;~廉-c校;T菊年-c校;⒌-c校;周琪生-c校;f壅-c校,1976年5月北京中A局,正史\五代；o,y,y,n,y,,本共150卷，其中本o61卷、志12卷、77卷，d了自朱温代唐（907）至北宋建立（960）之g共54年的v史。分梁、唐、x、h、周，一朝一史，各成w系，因S五代各自，故原名《梁唐xh周》，後^别于W修撰的《五代史》，改Q《f五代史》。由于《f五代史》的纂者大都H身v^五代的v史雒妫^近，因而保存了比^S富的原始Y料，五代各朝均有h，修史r多所采摭，使成研究@一r期的重要文IY料。本校c以南昌熊氏的影毂底本，同r用殿本、⒈炯芭肀尽⒖妆尽⒈R本相⑿＃并吸收了大量前人研究成果。,,1976,NO,http://www.gujilianhe.com/pages/productmetadata/form/list?id=ff80808154b87f9301550ae4aa6445e5
zhonghuajingdian_19,zhonghuajingdian,,,,新五代史,(宋)W修-撰;(宋)徐oh-注;垣-c校;柴德s-c校;石淑x-c校;李x-c校;李德清-c校;沈灌群-c校;周子美-c校;林艾@-c校;金祖孟-c校;袁英光-c校;徐震-c校;徐德嶙-c校;Rds-c校;光祖-c校;蚜-c校;梁永昌-c校;惠芬-c校;瑞[-c校;~百S-c校;w善r-c校;戴家祥-c校;修-c校;u逸麟-c校;-c校;~廉-c校;⒌-c校;T菊年-c校;周琪生-c校,1974年12月北京中A局,正史\五代；o,y,y,n,y,,本共74卷，其中本o12卷、列45卷、考3卷、世家及年V11卷、四夷附h3卷，d了自後梁_平元年（907）至後周@德七年（960）共53年的v史。《新五代史》改了《f五代史》朝代的界限，把五朝的本o、列骶C合在一起，依rg先後排，把列鞣各朝家人鳌⑺拦鳌⒁恍鳌㈦s臣鞯鹊取Ｔ囊括了小h、P等新史料，a充了《f五代史》中没有的史，是研究@段v史重要的史籍。本以百衲本工作本，πＡ速F池本、殿本、南昌本，同r⑿Ａ嗣魍粑氖⒈尽⒛媳O本、北O本、汲古w本、鄂本、徐注本等，是目前^完善的版本。,,1974,NO,http://www.gujilianhe.com/pages/productmetadata/form/list?id=ff80808154b87f9301550afc46b15b72
zhonghuajingdian_20,zhonghuajingdian,,,,宋史,(元)脱脱 等-撰;崇岐-c校;_^祖-c校;V-c校;何-c校;程B-c校;魏建猷-c校;家x-c校;徐光烈-c校;董家E-c校;裴汝\-c校;九思-c校;克述-c校;_君惕-c校;商w-c校;⒈彝-c校;吴B烈-c校;方-c校;王修g-c校;余先鼎-c校;蒲增元-c校;徐-c校;徐同甫-c校;R伯煌-c校;志x-c校;~方炎-c校;臧s炳-c校;⑿廾-c校;王文楚-c校;牟元-c校;汪槐g-c校;周S衍-c校;章左-c校;茂-c校;-c校;廷爵-c校;魏嵩山-c校;⒌-c校;郭群一-c校;李π-c校;-c校;T菊年-c校;周琪生-c校,1985年6月北京中A局,正史\宋；o,y,y,n,y,,全共496卷，其中本o47卷、志162卷、表32卷、列255卷，是二十四史中最大的一部官修史。宋史λ未的政治、、事、文化、民族PS、典章制度以及活釉谶@一v史r期的S多人物都做了^M的d，基本上保存了宋朝史的原貌，是研究伤稳百多年v史的基本史料。本以百衲本工作本，同r吸收了~渭清《元宋史校》和元《宋史校勘》稿本的成果，并⑿Ａ饲迩隆四年武英殿本和清光w元年浙江局本，是目前^完善的版本。,,1985,NO,http://www.gujilianhe.com/pages/productmetadata/form/list?id=ff808081559102e00155913571b40bf7
zhonghuajingdian_21,zhonghuajingdian,,,,|史,(元)脱脱 等-撰;T家N-c校;述-c校;金生-c校,1974年10月北京中A局,正史\|；o,y,y,n,y,,本共116卷，包括本o30卷，志32卷，表8卷，列45卷，Z解1卷，d了|政墓元907年到公元1125年砂俣嗄甑v史，也兼叙了|以前契丹族和|末耶律大石建立的西|的v史，是F存唯一的完整d|代的官修史，提供了研究朝代社生活的FY料。本c校以百衲本工作本，用乾隆殿本M行通校，以南O本、北O本和道光殿本M行⑿＃又用《永反蟮洹匪引《|史》校Γ并⒖剂恕恫岣元》《Y治通a》《mY治通aL》等以及前人的研究成果。,,1974,NO,http://www.gujilianhe.com/pages/productmetadata/form/list?id=ff80808154b87f930155052f59bb1e21
zhonghuajingdian_22,zhonghuajingdian,,,,金史,(元)脱脱 等-撰;傅坊-c校;政R-c校;崔文印-c校,1975年7月北京中A局,正史\金；o,y,y,n,y,,本共135卷，其中本o19卷，志39卷，表4卷，列73卷，述了上起金太祖收元年（1115），下至金哀宗天d三年（1234）蒙古缃鹬g120年的v史。元修《金史》，H是在前人基A上的加工整理。r依的史料，主要有金代h，中yg王所作《金史》，⑵睢w志》和元好的《壬辰s》等，故《金史》乃宋、|、金三史中撰得最好的一部。本系y地d了女真族的l展v史，尤其是女真及各族早期的情况，多不于其它史籍。本以百衲本底本，并c北O本、殿本⑿＃裆贫模⒖剂恕洞蠼志》《大金t伐h》《w志》等，以及存的《永反蟮洹返挠嘘P部分，并吸收了大量前人的研究成果，是F存^完善的版本。,,1975,NO,http://www.gujilianhe.com/pages/productmetadata/form/list?id=ff80808154b87f93015507b1950c18f6
zhonghuajingdian_23,zhonghuajingdian,,,,元史,(明)宋濂 等-撰;翁健-c校;n儒林-c校;邵循正-c校;亦真-c校;周清澍-c校;姚景安-c校,1976年4月北京中A局,正史\元；o,y,y,n,y,,本共210卷，包括本o47卷、志58卷、表8卷、列97卷，是一部比^系y地d元代d亡^程的史。《元史》的修，主要是依元代各朝h、世大典、功臣列鞯裙傩薜浼，更多地保存了元代史料的原貌，且文字\@，明白易懂，但由于修rg}促，且出自\手，亦有取尾划之弊。本校c以百衲本底本，并⑿Ａ吮北O本、殿本和道光本，⒖剂恕对史m》《元史》《廿二史考》等。此外，本利用了一批常的原始Y料，校正有P的史文，并吸收了大量前人成果。,,1976,NO,http://www.gujilianhe.com/pages/productmetadata/form/list?id=ff80808154b87f930155054837f3537a
zhonghuajingdian_24,zhonghuajingdian,,,,明史,(清)廷玉 等-撰;天挺-c校;白垡-c校;王毓-c校;周振甫-c校;魏B科-c校,1974年4月北京中A局,正史\明；o,y,y,n,y,,本共322卷，其中本o24卷、志75卷、表13卷、列220卷，d了拿骱槲湓年（1368）到崇十七年（1644）共276年的v史。《明史》以《明史稿》{本，但在排上更加整R，内容S富，叙事M，堪Q正史中“最完善”之作，是研究明代v史的重要文I。本以武英殿原刊本底本M行分段它c，用《明h》和《明史稿》校勘，同r⒖肌睹典》《寰宇通志》《明一y志》《明世文》《榷》《寇o略》《蚜炅骺苁冀Kh》等，由天挺及南_大W明清史研究室完成c校初稿，由白垡汀⑼踟广、周振甫烷定稿，是目前^完善的版本。,,1974,NO,http://www.gujilianhe.com/pages/productmetadata/form/list?id=ff80808154b87f93015507ea99a30608
zhonghuajingdian_25,zhonghuajingdian,,,,清史稿,(清)w巽 等-撰;⒋竽-c校;_V-c校;功-c校;王R翰-c校;O毓棠-c校;吴淦-c校;何英芳-c校,1977年8月北京中A局,正史\清；o,y,y,n,y,,本是民初年所O清史^的述清代v史的未定稿，共536卷，按照v代封建正史的w例，分本o25卷、志142卷、表53卷、列316卷，因出于\手，故出F了很多e`和漏，但它⑺依的大部分材料如《清h》《史列鳌贰肚典》等M行了初步的〖整理，@就使得x者能够得到比^系y的清代史事素材。此外，有些志和清末人物的列鳎取材于y得到的史料。因此，本仍具有很高的⒖r值。本以P外二次本工作本，M行它c、分段及校正。本没有校勘。,,1977,NO,http://www.gujilianhe.com/pages/productmetadata/form/list?id=ff80808154b87f93015505a476667ad1
zhonghuajingdian_26,zhonghuajingdian,,,,Y治通a,(宋)司R光-著;(元)胡三省-音注;它cY治通a小M-c校,1956年6月北京中A局,v史\v代；年,y,y,n,y,,本共294卷，是我第一部年w通史，以rgV，事件目，起于周威烈王二十三年（前403），止于五代後周世宗@德六年（959）征淮南，d了横跨十六朝，共1362年的v史。主司R光以君H政，t明之道出lc，著重墨于各朝代的t明r期，名宋神宗所定，取“有a于往事，以Y于治道”之意。其所d史事，近略h，并于叙事之後皆附有u，共186篇，其中“臣光曰”有102篇，其N84篇各家u。《通a》自宋以碛兄T多刻本，本以清胡克家翻刻的元刊胡注本底本，并吸取了章《胡刻通a正文校宋》的成果，重要校文都以“章”字俗R，收入本注文。,,1956,NO,http://www.gujilianhe.com/pages/productmetadata/form/list?id=ff80808154b87f930155065b9f4c2719
zhonghuajingdian_27,zhonghuajingdian,,,,mY治通a,(清)沅-撰;它cmY治通a小M-c校,1957年8月北京中A局,v史\清；年,y,y,n,y,,本共220卷，上c《Y治通a》相接，d了上起宋太祖建隆元年（960），下迄元帝至正二十八年（1368）共411年的史事，是一部^完涞乃芜|金元年史。作者e二十N年之力，四易其稿，以宋、|、金、元四朝正史，以徐乾W《mY治通a後》基A，⒁岳c《mY治通aL》、李心鳌督ㄑ滓砝M年要h》、~隆Y《契丹志》及各家h部、文集s百凳N，述明，文字要，展示了宋、|、金、元四朝d衰治y的v史，其中北宋部分^精_，元代部分^略，λ巍⑦|、金、元v史的t解研究有O高的史料r值。本以T集梧a刻本底本M行它c排印，并⑿Ｐ\本，是目前^完善的版本。,,1957,NO,http://www.gujilianhe.com/pages/productmetadata/form/list?id=ff8080815427ed70015436d55b402aec
